{
  "stem": "hp/HP_7475A_Short_Form_Feb_89",
  "vendor": "hp",
  "doc": "HP_7475A_Short_Form_Feb_89",
  "source_pdf": "pdf/hp/HP_7475A_Short_Form_Feb_89.pdf",
  "page_count": 12,
  "pad_width": 2,
  "pipeline_version": "0.3.0",
  "generated_at": "2026-06-16T17:36:56Z",
  "phases": {
    "render": {
      "tool": "pymupdf",
      "tool_version": "1.27.2.3",
      "duration_seconds": 2.844,
      "per_page_seconds_avg": 0.237,
      "started_at": "2026-06-16T17:35:50Z",
      "ended_at": "2026-06-16T17:35:53Z",
      "params": {
        "small_width": 1024,
        "big_dpi": 200,
        "jpeg_quality": 85
      },
      "status": "ok"
    },
    "text": {
      "tool": "pymupdf",
      "tool_version": "1.27.2.3",
      "duration_seconds": 0.046,
      "per_page_seconds_avg": 0.004,
      "started_at": "2026-06-16T17:35:53Z",
      "ended_at": "2026-06-16T17:35:53Z",
      "params": {},
      "status": "ok"
    },
    "markdown": {
      "tool": "docling",
      "tool_version": "2.102.2",
      "duration_seconds": 63.267,
      "per_page_seconds_avg": 5.272,
      "started_at": "2026-06-16T17:35:53Z",
      "ended_at": "2026-06-16T17:36:56Z",
      "params": {
        "do_ocr": true
      },
      "status": "ok"
    },
    "quality": {
      "tool": "builtin",
      "tool_version": "0.3.0",
      "duration_seconds": 0.064,
      "per_page_seconds_avg": 0.005,
      "started_at": "2026-06-16T17:36:56Z",
      "ended_at": "2026-06-16T17:36:56Z",
      "params": {
        "threshold": 0.5
      },
      "status": "ok"
    }
  },
  "pages": [
    {
      "page": 1,
      "label": "page-01",
      "markdown": "data-extraction/markdown/hp/HP_7475A_Short_Form_Feb_89/page-01.md",
      "text": "data-extraction/text/hp/HP_7475A_Short_Form_Feb_89/page-01.txt",
      "jpeg_small": "data-extraction/jpeg/hp/HP_7475A_Short_Form_Feb_89/small/page-01.jpg",
      "jpeg_big": "data-extraction/jpeg/hp/HP_7475A_Short_Form_Feb_89/big/page-01.jpg",
      "source": "text-layer",
      "quality_score": 0.85,
      "flagged": false
    },
    {
      "page": 2,
      "label": "page-02",
      "markdown": "data-extraction/markdown/hp/HP_7475A_Short_Form_Feb_89/page-02.md",
      "text": "data-extraction/text/hp/HP_7475A_Short_Form_Feb_89/page-02.txt",
      "jpeg_small": "data-extraction/jpeg/hp/HP_7475A_Short_Form_Feb_89/small/page-02.jpg",
      "jpeg_big": "data-extraction/jpeg/hp/HP_7475A_Short_Form_Feb_89/big/page-02.jpg",
      "source": "text-layer",
      "quality_score": 0.85,
      "flagged": false
    },
    {
      "page": 3,
      "label": "page-03",
      "markdown": "data-extraction/markdown/hp/HP_7475A_Short_Form_Feb_89/page-03.md",
      "text": "data-extraction/text/hp/HP_7475A_Short_Form_Feb_89/page-03.txt",
      "jpeg_small": "data-extraction/jpeg/hp/HP_7475A_Short_Form_Feb_89/small/page-03.jpg",
      "jpeg_big": "data-extraction/jpeg/hp/HP_7475A_Short_Form_Feb_89/big/page-03.jpg",
      "source": "text-layer",
      "quality_score": 0.85,
      "flagged": false
    },
    {
      "page": 4,
      "label": "page-04",
      "markdown": "data-extraction/markdown/hp/HP_7475A_Short_Form_Feb_89/page-04.md",
      "text": "data-extraction/text/hp/HP_7475A_Short_Form_Feb_89/page-04.txt",
      "jpeg_small": "data-extraction/jpeg/hp/HP_7475A_Short_Form_Feb_89/small/page-04.jpg",
      "jpeg_big": "data-extraction/jpeg/hp/HP_7475A_Short_Form_Feb_89/big/page-04.jpg",
      "source": "text-layer",
      "quality_score": 0.85,
      "flagged": false
    },
    {
      "page": 5,
      "label": "page-05",
      "markdown": "data-extraction/markdown/hp/HP_7475A_Short_Form_Feb_89/page-05.md",
      "text": "data-extraction/text/hp/HP_7475A_Short_Form_Feb_89/page-05.txt",
      "jpeg_small": "data-extraction/jpeg/hp/HP_7475A_Short_Form_Feb_89/small/page-05.jpg",
      "jpeg_big": "data-extraction/jpeg/hp/HP_7475A_Short_Form_Feb_89/big/page-05.jpg",
      "source": "text-layer",
      "quality_score": 0.85,
      "flagged": false
    },
    {
      "page": 6,
      "label": "page-06",
      "markdown": "data-extraction/markdown/hp/HP_7475A_Short_Form_Feb_89/page-06.md",
      "text": "data-extraction/text/hp/HP_7475A_Short_Form_Feb_89/page-06.txt",
      "jpeg_small": "data-extraction/jpeg/hp/HP_7475A_Short_Form_Feb_89/small/page-06.jpg",
      "jpeg_big": "data-extraction/jpeg/hp/HP_7475A_Short_Form_Feb_89/big/page-06.jpg",
      "source": "text-layer",
      "quality_score": 0.85,
      "flagged": false
    },
    {
      "page": 7,
      "label": "page-07",
      "markdown": "data-extraction/markdown/hp/HP_7475A_Short_Form_Feb_89/page-07.md",
      "text": "data-extraction/text/hp/HP_7475A_Short_Form_Feb_89/page-07.txt",
      "jpeg_small": "data-extraction/jpeg/hp/HP_7475A_Short_Form_Feb_89/small/page-07.jpg",
      "jpeg_big": "data-extraction/jpeg/hp/HP_7475A_Short_Form_Feb_89/big/page-07.jpg",
      "source": "text-layer",
      "quality_score": 0.85,
      "flagged": false
    },
    {
      "page": 8,
      "label": "page-08",
      "markdown": "data-extraction/markdown/hp/HP_7475A_Short_Form_Feb_89/page-08.md",
      "text": "data-extraction/text/hp/HP_7475A_Short_Form_Feb_89/page-08.txt",
      "jpeg_small": "data-extraction/jpeg/hp/HP_7475A_Short_Form_Feb_89/small/page-08.jpg",
      "jpeg_big": "data-extraction/jpeg/hp/HP_7475A_Short_Form_Feb_89/big/page-08.jpg",
      "source": "text-layer",
      "quality_score": 0.85,
      "flagged": false
    },
    {
      "page": 9,
      "label": "page-09",
      "markdown": "data-extraction/markdown/hp/HP_7475A_Short_Form_Feb_89/page-09.md",
      "text": "data-extraction/text/hp/HP_7475A_Short_Form_Feb_89/page-09.txt",
      "jpeg_small": "data-extraction/jpeg/hp/HP_7475A_Short_Form_Feb_89/small/page-09.jpg",
      "jpeg_big": "data-extraction/jpeg/hp/HP_7475A_Short_Form_Feb_89/big/page-09.jpg",
      "source": "ocr",
      "quality_score": 0.85,
      "flagged": false
    },
    {
      "page": 10,
      "label": "page-10",
      "markdown": "data-extraction/markdown/hp/HP_7475A_Short_Form_Feb_89/page-10.md",
      "text": "data-extraction/text/hp/HP_7475A_Short_Form_Feb_89/page-10.txt",
      "jpeg_small": "data-extraction/jpeg/hp/HP_7475A_Short_Form_Feb_89/small/page-10.jpg",
      "jpeg_big": "data-extraction/jpeg/hp/HP_7475A_Short_Form_Feb_89/big/page-10.jpg",
      "source": "ocr",
      "quality_score": 0.85,
      "flagged": false
    },
    {
      "page": 11,
      "label": "page-11",
      "markdown": "data-extraction/markdown/hp/HP_7475A_Short_Form_Feb_89/page-11.md",
      "text": "data-extraction/text/hp/HP_7475A_Short_Form_Feb_89/page-11.txt",
      "jpeg_small": "data-extraction/jpeg/hp/HP_7475A_Short_Form_Feb_89/small/page-11.jpg",
      "jpeg_big": "data-extraction/jpeg/hp/HP_7475A_Short_Form_Feb_89/big/page-11.jpg",
      "source": "ocr",
      "quality_score": 1.0,
      "flagged": false
    },
    {
      "page": 12,
      "label": "page-12",
      "markdown": "data-extraction/markdown/hp/HP_7475A_Short_Form_Feb_89/page-12.md",
      "text": "data-extraction/text/hp/HP_7475A_Short_Form_Feb_89/page-12.txt",
      "jpeg_small": "data-extraction/jpeg/hp/HP_7475A_Short_Form_Feb_89/small/page-12.jpg",
      "jpeg_big": "data-extraction/jpeg/hp/HP_7475A_Short_Form_Feb_89/big/page-12.jpg",
      "source": "ocr",
      "quality_score": 0.85,
      "flagged": false
    }
  ]
}
